"ID","Joke"
1,"What did the bartender say to the jumper cables? You better not try to start anything."
2,"Don't you hate jokes about German sausage? They're the wurst!"
3,"Two artists had an art contest... It ended in a draw"
4,"Why did the chicken cross the playground? To get to the other slide."
5,"What gun do you use to hunt a moose? A moosecut!"
6,"If life gives you melons, you might have dyslexia."
7,"Broken pencils... ...are pointless."
8,"What did one snowman say to the other snowman? 'Do you smell carrots?'"
9,"How many hipsters does it take to change a lightbulb? It's a really obscure number. You've probably never heard of it."
10,"Where do sick boats go? The dock!"
11,"I like my slaves like I like my coffee: Free."
12,"My girlfriend told me she was leaving me because I keep pretending to be a Transformer... I said, No, wait! I can change!"
13,"Old Chinese proverb: Man who not shower in 7 days makes one reek."
14,"What did the owner of a brownie factory say when his factory caught fire? ""I'm getting the fudge outta here!"""
15,"What form of radiation bakes you cookies? A gramma ray"
16,"Bee jokes, courtesy of my niece (age 8). What did the bee use to dry off after swimming? A *bee*ch towel. What did the bee use to get out the tangles? A honeycomb."
17,"What's the loudest economic system? CAPITALISM"
18,"I went for a job interview today... The interviewer said to me, What would you say your greatest weakness is? I said, I think Id have to say my listening skills are my greatest strength."
19,"Who was the knight that invented the round table? Sir Cumference. (via friend who got this from a street performance group in the England area of Epcot)"
20,"What did the German air force eat for breakfast during WW2? Luftwaffles"
21,"I the shell off a snail yesterday... you'd think it would move faster, but it was really kinda sluggish."
22,"What did the number zero say to the number eight? ""Nice belt."""
23,"What's worse than a centipede with sore feet? A giraffe with a sore throat"
24,"What's red and bad for your teeth? A brick."
25,"Why did the Chicken cross the playground? To get to the other slide"
26,"Did you hear about the French chef who committed suicide? He lost the huile d'olive"
27,"Wanna hear a joke about unemployed people? Nevermind, they don't work."
28,"Knock Knock Who's there Boo!! Boo who? Don't cry, it's only a joke"
29,"How much did the skeleton charge for his excellent legal services? An arm and a leg."
30,"Why do gorillas have such big nostrils? Cos they got big fingers."
31,"What is the difference between a Siberian husky and an Alaskan husky? About 1500 miles."
32,"What do vegan zombies eat? GRAAAIIINSSS!"
33,"What's the difference between a Thai man and a Thai woman? Pls help."
34,"What do you call a car that eats other cars? A carnivore."
35,"Why did the golfer wear two pairs of pants In case he gets a hole in one"
36,"An Olympic gymnast walked into a bar... She didnt get a medal..."
37,"What does a mexican magician make for breakfast? Toast-tah-dahs!"
38,"Why don't Bond villains feel cold in the winter? Because they dress in lairs."
39,"What did the figurine say when the boot flew past her protective dome? ""That was a cloche call!"""
40,"What was Carl Sagan's favorite drink? Cosmos."
41,"What is the medical term for owning too many dogs? [A Roverdose](http://i.imgur.com/BtyF5ys.jpg)"
42,"Knock knock... Who's there? I did up. I did up-who?"
43,"I like my jokes they way I like my robots. Killer."
44,"What type of school did Sherlock Holmes go to? Elementary :)"
45,"My friend told an out of place joke about police searches. But I don't think it was warranted."
46,"The Dalai Lama walks into a pizza store... and says, ""Can you make me one with everything?"""
47,"Why did the vampire use mouthwash? Because he had bat breath"
48,"What did the corn say when it was complemented? Aww, shucks!"
49,"What did the green grape say to the purple grape? - ""Breathe, stupid!"""
50,"Why did the Fall break off from all the other seasons? Because it wanted autumnomy"
51,"If I ever fire someone who is a Taylor Swift fan I'll say ""I knew you were trouble when you clocked in."""
52,"What do you do if a cow is in the middle of the road you're driving on? steer clear"
53,"What do you call a blind, legless buck? No eye-deer. EDIT: I totally messed this joke up. Please give me another chance with another joke?"
54,"What do you get for the women who has everything? A divorce, then she'll only have half of everything."
55,"There was a depressed sausage... he thought his life was THE WURST."
56,"What's a dog's favorite mode of transportation? A waggin'"
57,"Why did the sand dune blush? Because the sea weed"
58,"What happened to the tyrannical peach? He got impeached!"
59,"Why do elephants paint their toenails red? So they can hide in cherry trees. You ever seen an elephant in a cherry tree? *Then it's working*."
60,"what did the mexican firecheif name his kids... Hose A and Hose B"
61,"What did the German physicist use to drink his beer? Ein stein. - From Big Nate, as told by my kid."
62,"What did earth say to the other planets? You guys have no life!"
63,"One time we ran out of soap- -so we had to use hand sanitizer!!!"
64,"Wanna hear a dirty joke? Two white stallions fell in the mud."
65,"What did one frog say to the other frog? Time's fun when you're having flies."
66,"Why did the boy take a pencil and paper to bed? He was told to draw the curtains before going to sleep."
67,"Clean joke about sorority girls Why do sorority girls only travel in odd numbered groups? Because they *can't even*!"
68,"What did the 8 say to the 0? Hey, fatty"
69,"KNOCK KNOCK! WHO'S THERE! ***sombrero **** ^sombrero who,,,? *****SOMBRERO-VER THE RAINBOW****"
70,"I'm reading a book about anti-gravity... ... It's impossible to put down"
71,"What name is given to the most chickens ? pEGGy"
72,"Why is Dr. Frankenstein never lonely? He's good at making friends."
73,"What do you call a pig that does karate? *A pork chop.*"
74,"What was the car doing in the dressing room? Changing attire."
75,"What do you call a pile of dogs? A ruff terrain."
76,"How do you prepare for a party in space? You Planet Thanks u/BostonCentrist"
77,"What do you get when you cross an octopus with a cow? A stern rebuke from the Ethics Committee, and an immediate cessation of funding."
78,"Why did the bicycle fall over? Because it was two-tired"
79,"Two bookworms were having a dispute... ...across an open book until one bookworm moves closer to the other and says, ""well then, I'm glad we're on the same page."""
80,"Which kitchen appliance tells the best jokes? The beater - he cracks everybody up!"
81,"Why did the jellyroll? He saw the apple turnover."
82,"Why did the chicken? Q: Why did the chicken cross the road naked? A: Because chickens don't wear clothes."
83,"What do you call Protestants who want to save a dime? Econoclasts."
84,"What do dwarves use to cut their pizza? Little Caesars"
85,"What did the fish say when it hit the wall? Dam."
86,"What's that coffee drink with icecream? I used to know it, but... Affogato."
87,"Where did Napoleon keep his armies? In his sleevies!"
88,"makeup beauty Omg = oh my girl so cute next morning without makeup Omg = ohh My God omg/omg = life without wife"
89,"Time flies like the wind. Fruit flies like... bananas!"
90,"What did Vincent van Gogh call himself when he joined the Justice League? The Starry Knight"
91,"Why did the boy take a ladder to school? He wanted to go to high school."
92,"What's the best thing to put into a pie Your teeth."
93,"What kind of house does a stoned loaf of bread live in? A high rise"
94,"What do you get when you cross a firecracker and a duck? A firequacker."
95,"What's a baker's biggest fear? Something going a-rye while they're raisin' bread."
96,"What's the best way to get a hold of Vin Diesel? IM Groot. : D Source: https://www.youtube.com/watch?v=Lvlj1u9S258"
97,"Why did everyone trust the marsupial? Everything he said was troo"
98,"This dermatologist waits a month to diagnose a skin disorder... She's reluctant to make a rash decision."
99,"Why are manhole covers round? Because manholes are round."
100,"What did one casket say to the other? ""Is that you coffin?"""
101,"How does a hamburger introduce his girlfriend? Meat patty! Thought of you guys!"
102,"How does a mathematician get Tan? Sin/Cos"
103,"What is a martian's favourite chocolate? A mars bar"
104,"Where did Sally go after the explosion? Everywhere."
105,"What did the cow say when it saw the farmer twice in one day? Deja Moo!"
106,"Congratulation on the new baby, from your family... except from me because I don't really care."
107,"What is agitated buy joyful? A washing machine"
108,"What do you call a sleeping dinosaur? A dino-snore."
109,"Breaking news! Energizer Bunny arrested... ...charged with battery."
110,"It's an emergency! I need underwear jokes. My baby sister needs underwear jokes for some mysterious reason. I need your guys help!"
111,"What did the butcher say when he handed his customer an empty pack of hotdogs on halloween? Happy halloweenie"
112,"Can February March? No, but April May."
113,"What's the internal temperature of a Taun-Taun? Lukewarm"
114,"What's it called when a planet orbits its sun 8 times? An orbyte"
115,"Why are there only two hundred and thirty nine beans in a bowl of bean soup? Because just one more and it would be two-farty"
116,"What does a nosey pepper do? It gets jalapeno business."
117,"Why don't blind people like to go skydiving? It scares their seeing-eye dog."
118,"what does clark kent have for breakfast? alter-eggos"
119,"I met Phil Spector's brother Crispin the other day. He's head of quality control at Lays."
120,"Who is William Shatner's mythical nemesis? The Lepre-khaaaaannnnn!!!!!"
121,"Two drums and a cymbal fall off a cliff... ba-dum tss"
122,"Why does Mario hate Punchbug? Because he bruises like-a Peach!"
123,"Where do pots go on vacation? JaPAN! From my 9 year old."
124,"When German children play a game involving touching each other with bread... it's called gluten tag. I'll show myself out."
125,"My laptop is so dumb. Every time it says ""Your password is incorrect"", I type in: ""incorrect"" and the silly thing still tells me the same thing."
126,"Did you hear about the scarecrow who won the Nobel Prize? He was outstanding in his field. From: http://www.dadlaughs.com"
127,"A man was caught stealing in a supermarket today... ...while balanced on the shoulders of a couple of vampires. He was charged with shoplifting on two counts."
128,"why didn't the bicycle cross the road? because it was two-tired."
129,"Every morning I run around the block 5 times... ...Then I slide the block back under the bed and go back to sleep"
130,"Says she: ""Say something soft and sweet"" Says he: ""Marshmallow."""
131,"Why do cicadas stay up all night chirping irregularly, unable to sleep? Their cicadan rhythm is off"
132,"What do you call a monk that operates a door unlocking service? A monkey. (p.s. I have a wonderful, terrible love for bad jokes)"
133,"What do you call people who pretend to be Irish on St. Patrick's Day? Counterfitz"
134,"What did the 0 say to the 8? Nice belt."
135,"I love when I have dramatic realizations over my morning cereal... ... I call 'em ""breakfast epiphanies"""
136,"Definitions Bigamist - An Italian fog. Myfunsalow - ""I am broke"" in Italian. Innuendo - Italian for suppository."
137,"Have you heard what I think of windmills? Big Fan."
138,"Max wondered why the ball was slowly growing larger... and then it hit him."
139,"I saw a documentary on how they make jeans... It was riveting."
140,"What goes ""Hahahahaha...*thud*""? Someone laughing their head off"
141,"Did you hear about the homemade poison ivy remedy? You can make it from scratch."
142,"What did the apple say to the pear? [Man, go] away!"
143,"When do elephants have eight feet? When there are two of them."
144,"I bought a duckdoo yesterday! 'What's a duckdoo?' ""quack, quack"""
145,"What do you call Batman skipping church? Christian Bail."
146,"A man started to throw words beginning with 'th' at me I dodge this, then and there but I didn't see that coming - Tim Vine"
147,"Why did the mobster buy a planner? So he could organize his crime"
148,"James Bond went to get a haircut. The barber asked him if he wanted to dye his hair as well. Bond replied ""Dye another day."""
149,"I named my cat ""Curiosity"". He killed himself ... Nine times."
150,"Why do they make Raisin Bran commercials? For raisin bran awareness."
151,"What do you call a bald porcupine? Pointless!"
152,"Where does the thumb meet its type? At the SPACE BAR! reddit is fun! I'm staring at the keyboard tryin' to think up a joke and voila'!"
153,"What's Beethoven's favorite fruit? A ba-na-na-naaaaa"
154,"I'm getting mighty fed up with these sheep-human hybrids! What is with ewe people!?"
155,"What the plate say to the other plate? Dinners on me"
156,"My finger became really swollen after I jammed it Friday. And thats how I found out Im allergic to jam."
157,"Sports: So how's the shoestring game goin'? Right now, it's ***ALL TIED-UP!*** Oh my-oh-my! I couldn't find a cornylamejokes subreddit, so... ~Skip"
158,"I wanted to put a pizza joke here ...but it was too saucy."
159,"What do you call a cow that just gave birth? Decaffeinated"
160,"Why did the bee go to the doctor? Because he had hives."
161,"How many ears does Captain Picard have? A right ear. A left ear. And a final front ear."
162,"What type of doctor prescribes Coke and 7-up for a living? A Poptometrist!"
163,"What's grey? A melted penguin!"
164,"Why was the healthy potato not allowed on the plane? He was on the ""No Fry"" list."
165,"I saw an all frog production of Frozen yesterday... It was toad-aly cool!"
166,"Just found this sub the other day and I've come to this realization... Currently, this subreddit seems to be in quite the pickle."
167,"If you ever get cold, just stand in the corner of a room for a while. *They're normally around 90 degrees.*"
168,"A farmer in (x-town) who rolled over a cart of horse manure... Is reported in ""stable condition."""
169,"What does a can of tuna say? Premium flaked tuna Best before dd/mm/yy"
170,"How many magazines did the racquetball footwear company make before going out of business? Tennis shoes (Also: can anyone think of a more succinct buildup? It seems kinda unwieldy to me)"
171,"Why was the actor detained by airport security? He said he was in town to shoot a pilot."
172,"What did the llama say when asked to a picnic? Alpaca lunch!"
173,"What do kids eat for breakfast? Yogoat!"
174,"Did you hear about the casting for the new Batman movie? People have really Ben Affleckted by it."
175,"What electronic device leaves behind a lot of broken glass? A PC, seeing how they typically run on Windows!"
176,"Why did the orange move to veggieland? So he could live in peas and hominy."
177,"A blind man walks into a bar. And a table. And a door. And a staircase. I don't think hes alright now."
178,"What do you call beef that's been burned? A mis-steak."
179,"How do cows get their gossip? They herd it through the bovine."
180,"[ This one from the great /u/KingOfRibbles ] ""My sink was a bit dirty-"" ""-but all it needed was a little ...wiping!!!"""
181,"Why doesn't the Sun go to college? Because he has a million of degrees."
182,"What do you call a sheep with no legs? A cloud."
183,"JKLMNOPQRST That's all that stands between U and I :)"
184,"Original physics joke. I'm very proud. I was organizing my desk the other day and the Entropy Police gave me a ticket for disturbing the chaos."
185,"There were two snowmen standing in a field, one says to the other... Can you smell Carrots?"
186,"What kind of jackets do Audiophiles wear? FLAC jackets"
187,"Shall I tell you the joke about the body snatchers? Best not, you might get carried away."
188,"Gravity makes a terrible friend. It's always holding you down."
189,"What do Catholics and guitar players have in common? Neither of them practice."
190,"Do you know why the bike couldnt stand by itself? It was TWO TIRED!!!"
191,"Just heard this on a PBS kids show... What did one wolf say to the other wolf? Howls it going?"
192,"A man enters a store and asks for a color printer, the cashier asks ""What color?"""
193,"An oldie but goldie! *How do you stop a charging bull?* ***Take away its credit card!*** wa-waa-waaaa! ~Skip"
194,"Two antennas met on a roof . . . Two antennas met on a roof, they fell in love and got married, the ceremony was awful but the reception was brilliant."
195,"Is it just me... ...or are circles pointless?"
196,"Why do cows wear bells? Because their horns don't work."
197,"What's brown and rhymes with Snoop? Dr. Dre"
198,"What's the difference between a bird and a fly? A bird can fly, but a fly can't bird."
199,"I've won the war! My pants fit! **Congratulations, have you lost weight?** _Even better... I've bought new pants!!!_"
200,"Two drums and a cymbal fall off a cliff. Buh dum tss!"
201,"What is Mozart doing right now? *Decomposing*"
202,"Whatever you do, always give 100%... Unless of course, you're donating blood."
203,"What did papa butter say to troublesome son butter? You had *butter* behave now, alright son? I sure know you don't want to get *whipped*!"
204,"Why does the dog go to the gym? He wants to get ruff"
205,"What kind of beer does a cow brew? Heifer-weizen."
206,"How do you make a squid laugh? Ten tickles."
207,"What cars do wolves drive? Auuuuuuuuuuuuudis!"
208,"What do you call a cow that doesn't give milk? A Milk Dud."
209,"What did the American call Karl Marx when a shrine was dedicated to him in Japan? A Kami."
210,"Why are locomotive drivers so good at driving locomotives? Because they were trained."
211,"What do you call a number that cant keep still? A roamin numeral."
212,"Why did the redditor go to /r/zelda? To boost his link karma! (X-post from /r/Jokes)"
213,"What did the Tin Man say when he got run over by a steamroller? Curses! Foil again!"
214,"How can you tell that a straight pin is confused? Just look at it. It's headed in one direction and pointed in the other."
215,"What is an astronaut's favorite meal? Launch"
216,"What do you do to dead chemists? You barium."
217,"Why did the tomato turned red? Because it saw the salad dressing"
218,"Why are contortionists always angry? Their work usually has them pretty bent out of shape."
219,"I never buy Velcro It's such a rip off."
220,"How do you unlock a monastery door? With a monk key."
221,"What is the ardent task of searching for a new wallpaper called? Running a Backgroud Check."
222,"When does one play a corny game? You play it by ear."
223,"The Great Yarn Race **Joe:** Did you hear about the great yarn race? **Jane:** No. Who won? **Joe:** Well, they had to weave their selves through the obstacles and in the end, it was a tie."
224,"a red ship and a blue ship crashed on an island together the survivors were marooned."
225,"Three tomatoes are walking down the street... A papa tomato, a mama tomato, and a baby tomato. The baby tomato starts falling behind so the papa tomato squishes him and says, Ketchup!"
226,"What happens at night in Bangladesh? It gets Dhaka"
227,"Why didn't the baby oyster share her little pearl? She was a little shellfish."
228,"Why did Humpty Dumpty have a great fall? To make up for a lousy summer."
229,"What kind of boats do smart people ride on? Scholar ships!"
230,"How do you turn soup into gold? You add 24 carats!"
231,"A photon checks into a hotel... The bellhop asks him if he has any luggage and the photon replies ""No. I'm travelling light."""
232,"I farted on an elevator, it was wrong on so many levels. From /r/PeterL"
233,"What language do they speak in Holland? Hollandaise."
234,"Last night, I had a dream that I was walking on a white sandy beach... At least that explains the footprints I found in the cat litter box this morning..."
235,"Why should you always bring 2 pair of trousers when golfing? In case you get a hole in one."
236,"Today I'm 45. But with the wind chill I feel like 32."
237,"/r/pickle welcomes it's newest ally. It's always good to have clean jokes. I due urge the mods to add us to your sidebar, due to the fact that you are on ours."
238,"Why are cats bad storytellers? Because they only have one *tale*"
239,"Balloon's What's a balloon's favorite genre of music? Pop."
240,"Why was the dolphin happy and the shark depressed? The sharks life lacked porpoise."
241,"What Johnny Mercer song does December 21st remind you of? Autumn Leaves."
242,"What's a comedian's favorite candy? Laffy Taffy."
243,"There's a guy at the office today wearing full camo. At least I think so... I haven't seen him in a while."
244,"Why do ghosts like to ride elevators? It lifts their spirits."
245,"How do you call for a bath? With a Teletubbie."
246,"Who was the chicken's favorite musician? BAAAACH BACH BACH BACH"
247,"X-post from r/jokes: Mommy! I found a $10 bill today, but I threw it away, cus it was fake. ""Oh, how did you know it was fake?"" ""It had two zeroes instead of one."""
248,"How much does it cost a pirate to get his ear pierced? A buccaneer!"
249,"What do you call the ghost of a chicken? A poultrygeist!"
250,"What's invisible and smells like carrots? Bunny farts."
251,"What did fish say when she hit the wall ? Dam(n) !!!"
252,"Why are colds such bad robbers? Because they're so easy to catch!"
253,"A man walks into an apple store and...... farts every one is really angry and there all shouting so he says it's not my fault you don't have windows"
254,"Why are pirates so mean? I dont know, they just arrrrrrrrr!"
255,"As I watched the dog chasing his tail, I thought, Dogs sure are easily amused!... ...then I realized I was watching the dog chasing his tail."
256,"What happened to the ghost who couldn't scare? He had to join a support group since he couldn't handle his boos."
257,"Did you hear about the butcher who backed into the meat grinder? He got a little behind in his work."
258,"What do vegetarian zombies eat? Graaaaaaiiiins......"
259,"Why did the lion spit out the clown? Because he tasted funny."
260,"What was Marie Curie's fitness program on the airwaves called? Radio-Activity"
261,"I went to the dermatologist about something on my neck- -and they said I just needed to scrub it!!!"
262,"Why was the math book sad? It had a lot of problems"
263,"What is the swamp-dwellers favorite form of extraterrestrial life? the Martians"
264,"Why do good farmers only excel when they are actually farming? (X-post from /r/jokes) Because they are out standing in their field."
265,"The cheesiest joke ever. ""I don't feel grate."" -- Block of Cheese before it got shredded."
266,"Every single morning I get hit by the same bike... It's a vicious cycle."
267,"What do get when you cross 50 female pigs with 50 male deer? One hundred sows and bucks?"
268,"You know youre getting old when Santa starts looking younger."
269,"I hate when you're trying to be cheesy but everyone is laughtose intolerant."
270,"What is irony? Irony is when something has the chemical symbol Fe."
271,"What do you call a cow with no legs? Ground beef!"
272,"was going to make a joke about science but I know for I wont get a reaction..."
273,"The other day, I sent my girlfriend a huge pile of snow... I called her up and asked, ''Did you get my drift?''"
274,"What do you call... What do you call an Italian romance novel model who's let himself go? Flabio."
275,"How many tickles does it take to make an octopus laugh? Ten tickles."
276,"How did the geologist develop a career as an expert in sinkholes? He fell into it."
277,"A bear and a rabbit are pooping in the woods The bear asks the rabbit - ""do you have a problem with poop sticking to your fur?"" ""Nope"" So the bear wipes his butt with the rabbit."
278,"Overheated some milk in a lab experiment today... ...and asked the teacher if it would affect the result. Her response? ""To a degree."""
279,"What's brown and sticky? A stick"
280,"I was gonna make a joke on Reddit.. .. but I guess you've already Reddit somewhere."
281,"Did you hear about the Antennas that got married? The wedding was lame, but the reception was great!"
282,"What is the most religious unit in electrical engineering? Ohm."
283,"I was walking in the desert and saw a redwood tree. I knew this must be a mirage, so I ran into it. To my dismay, the tree and I collided. I guess it must have been an obstacle illusion."
284,"A Bagpiper, a Kangeroo, an Irish poet, and Mother Theresa walk into a bar . . . . . . . the barman, who was drying a glass, lifted his head and asked, ""Is this some kind of joke?"""
285,"How many catholics does it take to change a lightbulb? CHANGE?!"
286,"Why don't you want a turkey at your thanksgiving dinner? Because it'll gobble up everything."
287,"What fruit do Romeo and Juliet eat? Cantelope"
288,"Why was 9 afraid of 20? 28 29's"
289,"What did one snowman say to the other? Do you smell carrots?"
290,"What do you call a race run by baristas? A **decaf**alon"
291,"What do you call a stegosaurus with carrots in its ears? Anything you want to - it can't here you!"
292,"What bird can write underwater? A ball-point Penguin!"
293,"What did the horse order at the bar? Chardaneiiiiiiggghhhhh"
294,"What was Beethoven's favorite fruit? BA-NA-NA-NA!"
295,"Why did the tissue get up and dance? It had a little boogy in it."
296,"Today a man knocked on my door and asked for a small donation towards the local swimming pool. I gave him a glass of water."
297,"What do sea monsters eat? Fish and ships."
298,"What did Virginia get when she walked into the pet shop? (state joke) A New Hampshire"
