"ID","Joke"
594,"I used to work at an orange juice factory... I ended up getting fired because I couldn't concentrate."
595,"Just wrote a book on reverse psychology... Don't read it!"
596,"Why did the melon get married in a church? Because he was in love with a cantaloupe."
597,"Why do fish live in salt water? Because *pepper* makes them sneeze!"
598,"Why was the apricot late to the party? He got stuck in a jam."
599,"Passwords 123456 abcdef Password"
600,"I knew I was old when I opened internet explorer."
601,"What does a storm cloud have on beneath its clothes? Thunderwear!"
602,"Where does the little king keep his little armies? Up his little sleevies."
603,"""What kind of house does cheese like to live in?"" ""A cottage"""
604,"Why did the bullet stay home? Because it got fired!"
605,"What do vegan zombies eat? GRAAAAINS"
606,"What do you call an economics lecturer? Prof. it"
607,"/r/cleanjokes hits 10K subscribers **/r/cleanjokes metrics:** Total Subscribers: 10,000 Subreddit Rank: 2,246 Milestones &amp; Subreddit Growth: http://redditmetrics.com/r/cleanjokes"
608,"Why did the rope get put in timeout? Because he was very knotty."
609,"What do mathematicians get if they stare at the roots of negative numbers for too long? Square eyes"
610,"I'm going to stand outside... So if anyone asks, I am outstanding."
611,"What is Forrest Gump's favorite pasta? Penne"
612,"Where did the universe attend college? At the university."
613,"How do you find Will Smith in the winter? You search for Fresh Prints."
614,"Why did the squirrel cross the road on the telephone wire? To be on the safe side!"
615,"What is Paula Deen's favorite insect? The Butterfly"
616,"What do you call an antelope that wants a big wedding? Cantelope"
617,"Why did no one ever consider Tony Stark (the Iron Man) a protagonist? Because he was always cited as the Anthony hero."
618,"What's the difference between a firstborn prince and a baseball? A baseball is thrown to the air."
619,"What do you call an Autobot who works in an overpriced makeup store at the mall ? Ulta Magnus!"
620,"I can't stand Russian Dolls... They're always so full of themselves!"
621,"What do you call a cow with no legs? Ground beef."
622,"A teacher asked her students to use the word ""beans"" in a sentence... ""My father grows beans,"" said one girl. ""My mother cooks beans,"" said a boy. A third student spoke up, ""We are all human beans."""
623,"What did the mailman say when his Mail truck caught fire? That he needed to address the situation"
624,"Math problem: I had 10 chocolate bars and ate 9. What do I have now? ""Oh, I do not know, DIABETES MAYBE!"""
625,"Why don't cannibals like clowns? they taste funny!"
626,"What's the difference between pea soup and roast beef? Anyone can roast beef..."
627,"Did you know that protons have mass? &gt;Yes Well I didn't even know they were Catholic!"
628,"How do you find Will Smith in the snow? Look for the fresh prints."
629,"*THUD* ""What was that?"" ""My pants fell down."" ""...Why so loud?"" ""I'm wearing them."""
630,"What do you call an Italian guy with a rubber toe? Roberto"
631,"What does a ghost cow say? *wave arms around* MoooooOOOOOOoooooooo"
632,"How much does wonton soup weigh? One ton, but I don't know anyone that'd wantonly order it."
633,"Saitama tried to change his Facebook password to Goku but Facebook said it was too weak..."
634,"Why did the fly fly? Because the spider spied her."
635,"What do you call a boomerang that doesn't come back? pt 2 A boomer-WRONG!"
636,"What do you call a Mexican with crazy intentions? A locomotive!"
637,"How many nihilists does it take to screw in a lightbulb? #"
638,"Where do snowmen dance? At the snowball!"
639,"Why is a shooting star better than a hamburger? It's meteor."
640,"Why did the vegetables hop into the boiling pot of water? They were part of a stewicide pact."
641,"I find hanging around in coffee shops A great way to espresso yourself"
642,"First post and an original How much does a Chinese elephant weigh? .................. Wonton"
643,"Heard the one about the corduroy pillowcase? It's making headlines."
644,"What do you get when you drop a piano down a mineshaft? A flat miner."
645,"Why did the spider land on the keyboard? She wanted a new website."
646,"Why did the woman buy new wine glasses? Because the ones she was using made everything blurry."
647,"What did one dry erase marker say to the other? I'm bored! (As in board) Another one from my 9 year-old."
648,"What did the tailpipe say to the muffler? I'm exhausted. What did the muffler say back? ^mmmmbfmbm"
649,"What do you cal a bear with extreme mood swings? A bi-polar bear."
650,"Why did the snail drink beer? To come out of its shell!"
651,"If I bought a balloon for $0.99 ... How much should I sell it for when I adjust for inflation?"
652,"I went out with anorexic twins last night... 2 birds, 1 stone"
653,"Why should you never invest in bakeries? Because they have a high turnover rate."
654,"a disability, a curse word and a radical interpretation of scripture walk into a bar nothing happened welcome to /r/cleanjokes"
655,"What do you call a bear with no teeth? *A gummy bear.*"
656,"Barely amusing Japanese joke Why are snakes so difficult to pick up in Japan? Because in Japan, snakes are hebi."
657,"A priest, a minister, and a rabbit walk into a bar... ...and the bartender says, ""What is this, a joke?"""
658,"No matter what anyone said, I was never going to take the stand. It's 1000 pages, for Pete's sake!"
659,"Why couldn't the skeleton cross the street? Because he didn't have the guts!"
660,"Why don't crabs give to charities? They are shellfish."
661,"Why did the mortgage broker go out of business? ...because he lost interest."
662,"My buddy the hacker took the quiz ""What Beatles song best describes your life."" The answer he got: ""My Way""."
663,"I hear that in Star Wars VIII they're going to introduce Han's perpetually depressed younger brother. His name is Y Solo."
664,"Did you hear about the skeleton who didn't go to prom? He had no body to go with."
665,"What do you call a group of people standing in the arctic circle? A Finnish line."
666,"Whats brown and rhymes with ""snoop""? Dr. Dre"
667,"I came into this subreddit expecting jokes about soap. I am mildly disappointed."
668,"What game do you play with a wombat? Wom."
669,"Wash the alligator clips with rubbing alcohol during flu season Protect yourself from catching a terminal illness."
670,"What age were pigs discovered in? The Saus Age."
671,"You've got to really be careful when ingesting shoes... cause they're usually laced"
672,"Did you hear about the guy who invented a knife that can cut four loaves of bread at once? He's calling it the ""Four Loaf Cleaver."""
673,"Armadillo The world needs more armed dillos."
674,"This is an X and Z conversation... Y are you in the middle?"
675,"What did the fish say when it swam into the wall? Dam."
676,"Heart attack When is the worst possible time to have a heart attack? When you are playing Charades."
677,"The hole in the boat So two guys steal a boat and get drunk. Kane of them goes ""Hey, there is a hole in this boat"". The other says ""don't worry it's not ours""."
678,"What is a tuna's favorite city? Albacoreque."
679,"What kind of pants does Super Mario wear? [Denim, denim, denim.](http://www.youtube.com/watch?v=c0SuIMUoShI)"
680,"Why did the cop wake up his son? To stop a kid napping."
681,"I hate people who talk about me behind my back... They discussed me."
682,"What did the Buddhist say to the hotdog vendor? Make me one with everything."
683,"I came up with a joke about my old cell phone Nevermind, it tends to get terrible reception"
684,"What did music tell the pancakes? B flat."
685,"What's Anakin Skywalker's favorite animal? Well, it was cats, originally, but then he was turned to the dog side."
686,"Have you seen the movie - Constipated? No? Why? Cause it hasn't come out yet!"
687,"Why did the people not like the restaurant on the moon? There was no atmosphere"
688,"Why did the grocery delivery guy get fired? He drove people bananas!"
689,"What does a thesaurus eat for breakfast? A synonym roll."
690,"What does Captain Kirk wear to the fitness center? Jim shorts."
691,"Did you hear about the lawyer for U2? He was Pro-Bono"
692,"What do you call an old fruit-picker in Wisconsin? Cherry-atric"
693,"I heard she accidentally spilled her chocolate milkshake on her white poodle- -knick knack paddy whack give the dog a... bath!!!"
694,"An idea for a board game... BONOPOLY - Similar to Monopoly, but where the streets have no name."
695,"Mary had a little lamb. She's not a vegan anymore."
696,"What did 0 say to 8? Nice belt!"
697,"Santa keeps his suits in the clauset."
698,"Why couldn't the woman date a German man? Because she was Klaustrophobic!"
699,"Knock! Knock! Knock! Knock! Whos there? Control Freak. Con Okay, now you say, Control Freak who?"
700,"How did the townspeople react when the mayor presented them with a cost efficient, vegan protein source? They chia'd."
701,"Did you hear that H.P. Lovecraft wrote a cookbook? It's called the Necronomnomnomicon."
702,"Why should you leery of stairs? Because they are always up to something."
703,"I'm calculating how much it would cost to install lights for a little league baseball field A ballpark estimate would be perfect"
704,"What is the horror movie Quija rated? Quija-13"
705,"So, a guy gave his friend 10 puns, hoping that one of them would make him laugh. Sadly, no pun in ten did."
706,"What was the allergic 2""X4""'s terrifying hallucination? He sawdust."
707,"What's orange and sounds like a Parrot? A Carrot"
708,"What's brown and sticky? A stick."
709,"What do you call a chef who's stingy with herbs? PARSLEYMONIOUS"
710,"Which US state is the friendliest towards the Japanese? Ohio"
711,"A classic: what do you call somebody with no body and no nose? Nobody knows."
712,"what do you call a fake noodle? An impasta! :D"
713,"What do Engineers use as birth control? Their Personality."
714,"How much does a pirate earing cost? A buccaneer"
715,"What do you call an alligator with a vest? An Investigator!"
716,"Seven days without a joke makes one weak."
717,"I'm a social person. I'm friends with 25 letters of the alphabet. I don't know why."
718,"My grandpa started walking five miles a day when he was 60... Now hes 97 years old and we have no idea where he is..."
719,"Where do toilets live? Porcel Lane."
720,"Why did the Country Bear Jamboree bear blush? Because he was a bear a-singing. ..... I am at Disney with the kids this week..."
721,"What's a martini's favorite garnish? Olive 'em!"
722,"Why did the chess master order a Russian bride? He needed a Chech mate!"
723,"What's the difference between a bag of chips and a duck with the flu? One's a quick snack and the other's a sick quack!"
724,"Why didn't the cargo ship want to leave the bay? Because it was a freight!"
725,"What do you call someone who really loves breakfast? A cereal killer."
726,"What did Captain Ahab say when he harpooned a whale's tail fin on the first try? ""Well that was a fluke."""
727,"What do you call someone that steals shoes? A sneaker."
728,"What song can never be played on #throwback Thursday? Friday by Rebecca Black"
729,"What did the neutrino say to the planet? Just passing through"
730,"What do you do with epileptic lettuce? You make a seizure salad!"
731,"Did you hear they're republishing that Simple Mathematics study guide? It's the revised edition. (Revise Addition)"
732,"Do you have a hole in your sock? ""No ..."" *(looks at sock)* . . How'd you get your foot in it?"
733,"What does a baker wear on his feet? Loafers."
734,"What cars do cows drive? Cattleacs"
735,"I was at Redbox, but I didn't know what to watch. I consulted my groceries, and my pizza said, ""Keep Frozen."""
736,"What do you get when you cross a pig and a spider? Bacon and scrambled leggs."
737,"Why didn't the fisherman go to Florida to fish for long jawed fish with rows of razor like teeth? He didn't have a Gar"
738,"Why don't robots have any brothers anymore? Because they have trans-sisters."
739,"Whats blue and smells like red paint? Blue paint"
740,"Darth Vader told me he knows what i'm getting for Christmas He said he felt my presents..."
741,"Why did the hippie drown? He was too *far out*!"
742,"What's the difference between a Jew and a pizza? The pizza can have ham and cheese together."
743,"Define ""Will"" Isn't it obvious? It's a dead giveaway!"
744,"There's a wreath hanging on my door with hundred dollar bills attached. I call it an Aretha Franklin. c:"
745,"How many roads must a man walk? 42."
746,"What is a spectre's favorite theme park attraction? The Roller Ghoster"
747,"What does a nosey pepper do? Gets jalapeno business!"
748,"Did you know that in high school, Robert E. Lee was voted ""most likely to secede?"""
749,"Did you hear the Offspring song about how to store mummies? ""You gotta keep 'em desiccated"""
750,"This is 2 girls with 1 cup. [A.K.A. Friends At (a) Cafe Bar](http://www.gettyimages.com/detail/photo/friends-at-cafe-bar-high-res-stock-photography/156534295)"
751,"Why were the treefrog's stories always so attention grabbing? Because he was absolutely ribbeting!"
752,"What do you call a slice of bread from another country? An immigraint."
753,"You know what they say about men that have big feet? #They wear big shoes! *Come on guys, this is /r/cleanjokes! Get your minds out of the gutter!*"
754,"Q: What do you call a deer with no eyes? A: No eye deer (No idea) Q: What do you call a quadriplegic deer with no eyes? A: Still, no eye deer. (Still no idea)"
755,"How many golfers does it take to change a light bulb? FOUR!"
756,"What did the famous musician say the moment he was born? *I'LL BE BACH*"
757,"What did the pebble say to the rock? I wish I was a little boulder!"
758,"What goes up and down but does not move? Stairs"
759,"In what town lives the mathematician who can only multiply by two? Dublin."
760,"What did the buffalo say to his son when he left for college? Bison"
761,"Why do Jamaican chickens make fun of all the other chickens? Because they're jerks."
762,"Did y'all hear the one about the professional jump-roper? Never mind. *Skip it*."
763,"The victim's body was found in the kitchen surrounded by eight empty boxes of cornflakes. Police suspect it was the work of a serial killer."
764,"""Stay strong!"" I said to my wi-fi signal."
765,"Pick up line for a Shakespeare lover. How now brown chicken brown cow?"
766,"Why did the snail draw an ""S"" on the side of his car? So that when he drove by people could say, ""Look at that escargot!"""
767,"When do you know you are getting a good deal on a boat? When there's a sail on it."
768,"What happens if socialism comes to the Sahara? Old Soviet-era joke told in Russia: What happens if socialism comes to the Sahara? Nothing at first, but then the sand shortages will start."
769,"How do sailors finish a corny joke on a boat? Ba dum ship."
770,"What's the best part of a baker's body? Their buns."
771,"What do you call coffee made from coal? Tarbucks."
772,"What did the three holes in the ground say? Well, well, well My grandpa's favorite joke. Took me five years to get it."
773,"When you ask a girl, Wanna go to the gym with me? https://www.youtube.com/watch?v=rQegAi6d-MM"
774,"I once ate a watch. It was time consuming, I didn't go back for seconds."
775,"Why do zombies always kill at comedy clubs? Because their jokes are told post-humorously!"
776,"What do you get when you cross a crocodile with a cartridge? A snapshot."
777,"Where do you learn to make ice cream? Sundae School"
778,"What is a rocket's favorite meal? Launch! Another one from my 9 year old."
779,"What do lawyers wear to court? Lawsuits."
780,"What do they call a monastery key that opens all doors? Monk key"
781,"I fell in the mud. And took a shower right after!"
782,"Fart tutor wanted, must have references"
783,"I do my best when my manager puts a gun to my head."
784,"What do you call someone who majors in geology and astronomy A rockstar"
785,"I rang up a local builder and said, ""I want a skip outside my house."" He said, ""I'm not stopping you."" **Tim Vine**"
786,"What kind of bird can write? A penguin."
787,"What did the bunny say to the frog? [My name is Rabbit, not ribbit!!](https://www.youtube.com/watch?v=CYkDxsaHlkg)"
788,"What do you get when you cross an elephant and a rhino? 'ell if I know wot to call it!"
789,"Why did the chef invest in chicken and cow bones? He wanted to buy stock options."
790,"What side of a leopard has the most spots? The outside"
791,"How was the Roman Empire cut in two? With a pair of Caesars."
792,"What's faster hot or cold? Hot! Because anyone can catch a cold! buh duh tsst"
793,"What did one octopus say to the other octopus? Will you hold my hand hand hand hand hand hand hand hand?"
794,"Why do fish always sing off key? Because you can't tune a fish. Say it outloud if you don't get it. I made this one up in first grade IIRC."
795,"[PICKLE] Our first chance to help our new ally! http://www.reddit.com/r/pickle/comments/1a2xg8/next_attack_for_our_entire_army_march_12th_at_520/"
796,"What type of cheese lives under your bed? Muenster."
797,"What did the 0 say to the 8? ... Hey, nice belt.."
798,"How does a duck pay for lipstick? She puts it on her bill"
799,"So I work in a Steak House and all the people there are really lazy So I must say after working there: That it's rare to see a job well done"
800,"What is H.P. Lovecraft's cook book called? The Necronomnomnomicon."
801,"Why did the rabbit go to rehab? He was hopped up on easter eggs."
802,"Knock Knock... 1.Knock knock. Whos there? Yoda lady. Yoda lady who? Good job yodeling! 2.Knock knock. Whos there? Well, not your parents, because your parents never knock!"
803,"What do you call cheese that isn't yours? Nacho cheese!"
804,"Reinventing Yourself http://dryinginside.blogspot.com/2012/10/reinventing-yourself-doesnt-always-work.html"
805,"What do you call a Macho Man Randy Savage that does not belong to you? &gt;Nacho Man Randy Savage!!!!! this is my original content!!!!"
806,"What does the horse call the pigs on his farm? Neigh-boars."
807,"What's brown and sticky? A stick"
808,"What is the world famous Chef Gordan's favorite football team? The Ramsays"
809,"My shower had a bit of mildew- -but all it took was a little... scrubbing!!!"
810,"Choose a major you love and you won't have to work for a day in your life Because that major probably has no jobs (not an original)"
811,"When is booger not a booger? When it('s not)."
812,"What's the longest word in the dictionary? ""Smiles"" because there is a mile between each S!"
813,"At the end of the Age of Dinosaurs what happened to the good ones? They got veloci-raptured."
814,"Which Pokemon got a cold? Pik-a-choo."
815,"What do you call someone who's studied Old Norse literature and become an expert. Well edda-cated."
816,"What instrument does God play? He plays the cello. As it says in scripture: ""Our God is a cellist God."""
817,"What do you call a fly with no wings? A walk."
818,"Want to hear a joke about a crappy restaurant? Nevermind, I'm afraid it may be in poor taste."
819,"Knock knock Who's there? Abby. Abby who. A bee has stolen my wallet. (I will show my self out)"
820,"Which celebrity is great at creating probate documents? Will Smith"
821,"Why couldn't Joe be friends with a double-amputee? Because he's lack-toes intolerant."
822,"What do you say when you find two banana peels together? Answer: A pair of slipper"
823,"Why cant college students take exams at the zoo? Too many cheetahs"
824,"I saw this man and woman wrapped in a barcode... I asked, Are you two an item?"
825,"A photon walks into a hotel. The bellhop asks if he needs help with his bags. The photon says, ""no, I'm travelling light. """
826,"If you're not buying kraft mac and cheese you might be buying an impasta."
827,"How do you make a kleenex dance? You put a little Boogie in it!"
828,"TV playback craziness [Through the eyes of Adrienne Hedger](https://www.facebook.com/HedgerHumor/photos/pb.630201143662377.-2207520000.1443863939./1179935295355623/?type=3&amp;theater). :)"
829,"What do you call a very religious person who sleep walks? A Roman Catholic."
830,"I don't have a Facebook or Twitter account... ...so I just go around announcing out loud what I'm doing at random times. I've got 3 followers so far, but I think 2 are cops."
831,"Soap addiction I used to be addicted to soap. But I'm clean now!!"
832,"Why is 6 afraid of 7? Because 7, 8, 9."
833,"What Did Delaware? A brand New Jersey!"
834,"Why don't you see penguins in Britain? Because they're afraid of Wales"
835,"New Internet acronym: RALSHMICOMN Rolling Around Laughing So Hard Milk Is Coming Out My Nose"
836,"How do you kill a circus? You stab it in the juggler."
837,"More retailers should adopt the ""Leave A Penny / Take A Penny"" system. It is literally, common cents."
838,"How much do pirates pay for earrings? about a buck an ear."
839,"Why did the boy throw a clock out the window? He wanted to see time fly."
840,"Which word is the longest in the English language? Smiles - because there is a mile between the first and last letters"
841,"What do you call a person who farts in private? A private tutor"
842,"Why did the raisin take the prune to the new year's ball? Because he couldn't find a date!"
843,"Why did the chicken soup cross the road? Because it was down hill!"
844,"What did one math book say to the other math book? We've got a lot of problems."
845,"Two competing podiatrists opened offices next door to each other... They were arch enemies. Edit: Spelling"
846,"What do you call fake German currency? Question marks"
847,"What do you call a fat psychic? A four chin teller."
848,"How does Harry Houdini tell people to steal stuff? Straight jack it."
849,"Why can't you hear a pterodactyl urinate? Because of the silent P."
850,"What do you call an Egyptian bone-setter? Cairo-practor."
851,"My first job... My first job out of college was a ""diesel fitter"" at a pantyhose factory... As they came off the line, I would hold them up and say, ""Yep, deez'll fit her!"""
852,"What did the closed can say to the half opened can? YOU'RE BEING UNCANNY!"
853,"Whats the problem with tainted money? It taint yours and it taint mine :D (Puns for the win? :D)"
854,"What do you call it when someone resuscitates a person who chokes on alcohol? La chaim-lich maneuver."
855,"How many minimalists does it take to screw in a light bulb? 1"
856,"What do you call a loaf baked in a zoo? Bread in captivity."
857,"Where does a river keep it's money? At the bank."
858,"What side of a turkey has the most feathers? The outside."
859,"My teacher's nickname in school is Flush. He always has the same suit."
860,"What kind of dish does LeBron like? anything with curry in it."
861,"There are 10 types of people in the world. Those who understand binary code and those who do not."
862,"What do lawyers wear to court? Law suits!"
863,"Why are the nordic countries the best countries to live in? Their flags are big plusses."
864,"When Captain Picard's sewing machine broke he brought it to the repairman and said... ""make it sew."""
865,"My brother... Likes driving black and white F1 race cars. They call him the F1 racist."
866,"What is green, fuzzy, and will kill you if it falls out of a tree? A pool table. [Thanks, Wagon Train camper!]"
867,"How do you make a tissue dance? You put a boogie in it! (Not sure of the spelling, heard it from someone)."
868,"Who makes the sweetest video games? Masahiro Saccharide"
869,"Someone dropped their Scrabble in the middle of the road... ...that's the word on the street anyway."
870,"Harry Potter can't tell the difference between his cooking pot and his best friend. [X Post from r/Fantasy] They're both cauldron."
871,"My dog chewed up my laptop... I guess he wanted a byte to eat! ^imagine ^this ^in ^zoidberg's ^voice"
872,"Why did the chicken cross the playground? To get to the other slide"
873,"Why don't cats play poker in the jungle... ...theres too many cheet-ahs"
874,"What did Ernie say to Bert when he asked for ice-cream? Sure, Bert!"
875,"Ask your doctor if left is right for you."
876,"Why was the tank top more gangster than the tube top? The tube top was strapless."
877,"This boy said he was going to hit me with the neck of a guitar.... I said, Is that a fret?"
878,"Apple just released a brand new programming language, *Swift*. Job recruiters everywhere immediately started posting ads for Swift programmers with 5 years of experience."
879,"Which way will it fall? If a rooster lays an egg on a pointed roof, which way will it land? Roosters don't lay eggs"
880,"What do you call a cow with a twitch? Beef jerky"
881,"I'm naming my TV remote Waldo... ...for obvious reasons."
882,"A platypus went into a hotel owned by a duck.. ..A platypus went into a hotel owned by a duck. Platypus ate food. Duck billed platypus"
883,"Have you heard about the Black Magic book for orphans? It's called the necro**mom**icon"
884,"What do you call a black and white bird that can't win, nor fly. A peng-lose."
885,"How do you catch a unique rabbit? *unique* up on it!"
886,"what keeps the lions from leaving the savannah the ele-fence"
887,"Will you tell you the story of the huge sad wall? I shouldn't, you'll never get over it."
888,"Where do you buy Pikmin from? The Oli-Mart"
889,"Where do literal dogs live? On the roof."
890,"I just bought a Bonnie Tyler sat-nav. It keeps telling me to turn around, and every now and then it falls apart."
891,"Why was the Headless Horseman depressed? He could never seem to get ahead in life."
