"ID","Joke"
299,"The other day, I was looking through my socks, when I found one had a hole in it... ""darn it..."" I muttered."
300,"What do you call the James Brown songs no one listens to? Defunct funk."
301,"Did you see the guy at Walmart hiding from ugly people?"
302,"You know what I hate about fashion designers? They are so clothes-minded."
303,"What do you call a spider with no legs? A raisin"
304,"A man walks into a bar... He says ""Ow"""
305,"Which is the most silky planet? Satin!"
306,"What does a train full of grain's whistle sound like? ""COUS, COUS!!!"""
307,"What do you say to someone who is making a cardboard belt? ""That's a waist of paper!"""
308,"Why didn't the skeleton go to the party? He had no *body* to go with"
309,"What do you call a race ran by female horses? A mare-a-thon."
310,"If April showers bring May flowers, what do May flowers bring? Pilgrims"
311,"What do you call a Moroccan candy distributor? Fez dispenser."
312,"Did you hear about the production delays at that company that makes scales using lengthy pipes? They had really long weights."
313,"We don't allow faster-than-light neutrinos in here, says the bartender. A neutrino walks into a bar."
314,"Almonds on the tree; Amonds off the tree cause to get them off the tree you hafta shake the ""L"" out of them!"
315,"Did you hear the one about the constipated mathematician? He worked his problem out with a pencil."
316,"How do crazy people go through the forest? They take the psycho-path."
317,"What did the mama pig give her baby pig for its rash? ***OINKMENT!*** &gt; (This exchange that I found on /r/tumblr makes this joke even funnier to me: &gt; http://i.imgur.com/EzT0Bkd.jpg)"
318,"What do you call a one-eyed dinosaur? Doyouthinkhesarus (Credit goes to whoever submitted that to the Coffee News)"
319,"Why do bears hate shoes so much? They like to run around in their bear feet."
320,"What do you call a cow with no legs? Ground beef."
321,"How do you think the unthinkable? With an itheburg."
322,"What do you call a bug that can't talk? A hoarse fly."
323,"Always put sunglasses on your tree. Then, you'll get the proper shade."
324,"Today I brought a computer back from the dead. I've decided that this makes me a techromancer."
325,"What is tuba plus tuba? Fourba!"
326,"Two dogs are going on a walk down the street They walk past a few parking meters and one dog says to the other, ""Hey, check it out! Pay toilets!"""
327,"Why couldn't Elsa hold on to a balloon? She would always let it go."
328,"How can you tell if a hamburger was grilled in space? It's a little meteor."
329,"What did the amazed Kazakhstani say? That's Astana-shing"
330,"Why don't blind people skydive? Because it scares their dogs too much!"
331,"When is a door not a door? When it's a jar"
332,"What's Medusa's favorite kind of cheese? Gorgonzola."
333,"Why Does Snoop Dogg need an umbrella? For drizzle, my nizzle. :D"
334,"My dental hygienist retired after working 55 years... All she got was a lousy plaque..."
335,"I've just made a meeting site for retired chemists It's called Carbon Dating"
336,"What do you call a parade of rabbits hopping backwards? A receding hare-line."
337,"Two wrongs don't make a right... but three lefts make a right. And two Wrights make a plane 6 lefts make a plane."
338,"Why did the library book go to the doctor? It needed to be checked out; it had a bloated appendix."
339,"A frog decided to trace his genealogy one day... He discovered he was a tad Polish."
340,"Two artists had an art contest... It ended in a draw"
341,"What did the fish say before he hit the wall? Oh, Dam."
342,"What's the smartest dinosaur? Thesaurus Rex! omg, I crack myself up! ~Skip"
343,"I like camping but... it's so in tents"
344,"If the house is in the kitchen, and Diana's in the kitchen, what's in Diana? A state (Indiana)"
345,"A sentence and a phrase is arguing, what did the sentence say? I know where you're coming from this phrase, but I can't see your point."
346,"What's brown and sounds like a bell? Dung."
347,"What's a balloon's favorite genre of music? Pop."
348,"Did you hear about what happened with the elk? It was really amoosing."
349,"I got hit hard in the head with a can of 7up today... I'm alright though, it was a soft drink."
350,"What's so great about living in Switzerland? Well, the flag is a big plus."
351,"Why did the girl quit her job at the donut factory? She was fed up with the hole business."
352,"What colour T-shirt would win a race? Red, because it runs the most."
353,"Why was the Egyptian kid confused? Because his daddy was a mummy"
354,"After watching a strongman competition... it amazed me to see how much the human body can lift without pooing itself."
355,"What did the O say to the 8? Nice belt."
356,"Why was the burrito embarrassed? It saw the salad dressing."
357,"How many tickles does it take to make an octopus laugh? Ten tickles"
358,"What do you call a bunch of Asian bears roaring? Panda-monium."
359,"What does a rock do all day? Nothing. (this joke was made by daughter when she was 5)"
360,"The joke of 2016 Trump"
361,"How does Han Solo like to get around Endor? Ewoks"
362,"I don't have the faintest idea why I passed out Just a short pun"
363,"What do you call a vegetarian? A hopeless romaine-tic"
364,"I want to die peacefully in my sleep, like my grandfather... Unlike the passengers in his car who were screaming and yelling! http://www.thedailyenglishshow.com/friday-joke/98-how-to-die/"
365,"What do you call a chicken crossed with a cow? Cock-a-doodle-moo!"
366,"Kind of a kid joke What kind of cereal do zombies like? Kellog's All Brain"
367,"What did the farmer say when he lost his tractor? Where's my tractor?"
368,"What do you call a blind deer? No-eye deer. What do you call a blind deer with no legs? *Still* no-eye deer."
369,"Why are proteins so cranky? Because they're made of a mean ol' acids."
370,"What do you call a pachyderm that doesn't matter? Irrelephant."
371,"What are caterpillars afraid of? DOGerpillars!"
372,"Why should you never invite a boxer to a party? He always throws the punch."
373,"How much does it cost for a pirate to get his ear pierced? A buccaneer."
374,"I was addicted to the hokey pokey but I turned myself around."
375,"Why didn't the bicycle cross the road? ...he was two-tired..."
376,"Why did the Russians use peanuts for torture in the Cold War? Because in Soviet Russia, Nut Cracks You!"
377,"How do trees get online? They just log in..."
378,"Apparently vegetables can hear when they're being eaten. So I always drown mine in salad dressing first. Because it's the Romaine thing to do."
379,"Why were Wrigley, Doublemint, and Orbit watching CNN? To find out the latest on gum control legislation."
380,"I wanna make a joke about sodium. But Na."
381,"Why couldn't the melons be together? Everyone knows melons cantaloupe."
382,"Why couldn't the alligator satisfy his lover? He had a reptile dysfunction."
383,"What's a blind person's favorite fast food joint? Taco Braille"
384,"The preacher today used Star Wars as a sermon illustration. I felt it was a little forced."
385,"What did the grape say when it got stepped on? Nothing, it just gave a little wine"
386,"Why are giraffes' necks so long? Because their heads are so far away from their bodies."
387,"what's orange and sounds like a parrot? a carrot."
388,"Why was the panda crying? He had a bambooboo. Aonther one from my 9 year old."
389,"Why does Thor have insomnia? He's up all night to get Loki."
390,"Did you hear the one about the three eggs? Too Bad."
391,"/r/askreddit thread ""What's the best clean joke you know"" with thousands of replies http://www.reddit.com/r/AskReddit/comments/zrotp/whats_the_best_clean_joke_you_know/"
392,"Chemistry Student I'm a science teacher and once I asked one of my lazy students if he knew the chemical symbol for sodium. He replied, 'Na, I don't'. Lucky sod, he's only ever right periodically."
393,"What do you call a smart pig? Swinestein."
394,"So, I have this new knock knock joke You start... (when you get it)"
395,"Captain Ahab's crew were highly efficient sailors In fact, they were running like a whale oiled machine."
396,"What kind of fish would be good to tune a piano? Oh, you guessed it right ... the tuna fish!"
397,"Bulls from all over India sent a petition to SC asking it to classify them as 'Jallikatu Bulls'."
398,"Did you hear about NASA finding bones on the moon? Yeah,the cow didn't make it."
399,"Some people have trouble sleeping... ...but I can do it with my eyes closed..."
400,"I think I want a job cleaning mirrors... ...it's just something I can see myself doing."
401,"What did the eye say to the other eye? Something smells between us."
402,"Did you hear about the kidnapping in Delaware? Don't worry, he eventually woke up."
403,"What animal is best at hitting a baseball? A bat!"
404,"Why did the octopus beat the shark in a fight? Because the octopus was well armed."
405,"I'll always remember what my uncle said before he passed on up... ""Flying houses? Talking dogs? That movie looks dumb."""
406,"Whats Red and Smells Like Blue Paint? Red Paint"
407,"Why did Little Miss Muffet have GPS on her Tuffet? To keep her from losing her whey."
408,"What do you call an obese psychic that works at a bank? A four chin teller"
409,"A man walked into a doctor's office . . . He said to the doctor: ""I've hurt my arm in several places."" The doctor said: ""Well don't go there any more."""
410,"Why did the chicken lay an egg? (Quoted from daughter at age 3) To get food for her babies!"
411,"Why do Gastroenterologists have such a passion for their job? Because they find the components of one's stomach very intestine."
412,"Science joke The bartender says ""we don't serve your kind here"" He orders a drink A Tachyon walks into a bar Who wants to hear a Tachyon joke?"
413,"How much does it cost a pirate to pierce his ears? A buccaneer!"
414,"There's a TV channel where you can buy all the Pope's speeches It's called ""Papal View""."
415,"So today is Earth day on what grounds are we celebrating?"
416,"What did one slice of bread say to the other at the end of a game of chess? ""It's stale, mate."""
417,"I heard it's a good night to see the Perseid meteor shower . . . . . . but I haven't heard how it got dirty."
418,"Why shouldn't you have coffee while on the clock? Because that would be ""grounds"" for termination!"
419,"What is green, has four legs and if it fell out of a tree and landed on you it would kill you? A pool table!"
420,"What do you call a Frenchman in sandals? Philippe Philoppe."
421,"What do you call a truthful piece of paper? Fax."
422,"What type of melon would Romeo and Juliet have been? Cantaloupe."
423,"What kind of turns do letters take? U-turns! *From my 9 year old son yesterday. Fixed typo."
424,"What did one computer CPU say to the other after getting hit? Ow! That megahertz!"
425,"Knock knock. Who's there? A cow. A cow who? Not a cow ""who""! A cow moos. An owl says ""who""."
426,"Did you take a shower today? Why, is one missing?"
427,"What did the Hungarian say to the annoying kid? ""You're nothing budapest!"""
428,"I was thinking of ways to become transgender... So I figured I'd fly to Paris. Because then I'd be abroad."
429,"How does the Mummy plan to destroy Superman? He's gonna lure him in to the crypt tonight."
430,"What do you call a cow with one leg? Steak."
431,"What concert tickets should cost $0.45? 50 cent feat. Nickelback :P"
432,"A woman files for divorce from her husband... citing that he makes too many Star Wars puns. When asked if this is true the husband says, ""Divorce is strong with this one."""
433,"Why can't you run in a camp ground? You can only 'ran'; it's past tents."
434,"What kind of soda do dogs drink? Barq's Root Beer."
435,"I saw a middle aged man staring at a picture of his very first steps. With tears in his eyes, he told me he regrets ever replacing the steps with an elevator."
436,"[OC] Why couldn't the dragon breathe fire? He had a cold"
437,"What do fish smoke? Seaweed!"
438,"Why is it a bad idea to get in a relationship with a statue? Because it's not going anywhere."
439,"Where do you go to weigh a pie? Somewhere over the rainbow weigh a pie. (sounds like way up high)"
440,"I forgot where I threw my boomerang. Oh wait.. It's coming back to me now."
441,"What did the Estonian student say in language class? I'll never Finnish. *dodges tomato*"
442,"What do you call the delivery boy at an Indian restaurant? Curry-er."
443,"I had to clean out my spice rack and found everything was too old and had to be thrown out. What a waste of thyme."
444,"Why were the breakfast potatoes running around hitting each other? HashTag!"
445,"What's the difference between Bird flu and swine flu? For one you get tweetment and the other you get oinkment..."
446,"Where do dogs go when they lose their tails? To a retail store."
447,"I have the opposite of a photographic memory i have a potatographic memory."
448,"Why did the vegetable band break up? They couldn't keep a beet."
449,"Why did the Spy cross the road? 'Cause he wasn't really on your side."
450,"What's orange and sounds like a parrot? A carrot"
451,"I invented a time machine... ...next week."
452,"Who was the only novelist with both direction and magnitude? Vector Hugo."
453,"My plumber finally quit on me... He couldn't take any more of my crap. Sorry that this isn't a CLEAN joke. Heh"
454,"I went to the store and asked for a one handed sailor... he said sorry, ""I'm a wholesaler."""
455,"what do you call an effeminate dwarf? A metro-gnome...."
456,"I told my girlfriend she drew her eyebrows on too high she looked surprised."
457,"What do you call a Jihadist that loves turkey? A Tryptophanatic."
458,"What did the Tin Man say when he got run over by a steamroller? Curses! Foil again!"
459,"Why there should be a February 30th So dentists can have a day to celebrate"
460,"What do you call a big pile of kittens? A meowtain."
461,"What do you call an arcade in eastern europe? czech-e-cheese"
462,"My relationship is like Monopoly. She gives me too many Chances."
463,"How do you call a deer with no eyes? No idea."
464,"Why did the bicycle fall over? Because it was two tired."
465,"What happened when the man couldn't afford the mortgage on his haunted house? ...it was repossessed!"
466,"My uncle wanted to give all his sheep a sex change... But it entailed too many ramifications!"
467,"How many dancers does it take to change a lightbulb? 5,6,7,8"
468,"What was wrong with the wooden car? It wooden go."
469,"What do caves have? Echosystems. From my 9 year-old."
470,"One fifth of people... ...are just too tense!"
471,"What do you call a fish with no eye? fsh"
472,"Where do rabbits like to eat breakfast? IHOP!"
473,"What did the wall ask the picture? (All together now!) ***""How's it hangin'?""*** ~Skip"
474,"Me have great grammar... Me learnt everything I know from Sesame Street!"
475,"If I don't eat all of my food, it goes to waste. If I do eat all of my food, it goes to *waist*."
476,"What did the green light say to the red light? I love you, but I'm sick of yellow light always breaking us up."
477,"What do you call the Hamburglar's accomplice? hamburglar helpler"
478,"Did you hear about the fight in the candy store? Two suckers got licked"
479,"Did I tell you I'm joining a gym in Gainesborough? Because I'm all about those gains bro"
480,"I have a lot of jokes about the unemployed... ...but none of them work."
481,"What is the last thing to go through a fly's mind when it hits a windshield? Its butt."
482,"Which fairground ride is made of iron? The ferrous wheel"
483,"What do you call a bulimic tree? Sycamore."
484,"Why was the lobster upset? Because he found out his friends thought he was a little crabby!"
485,"Did you hear about the ointment... Did you hear about the ointment that couldn't stop talking about politics? When confronted, he said he was just trying to be topical."
486,"What's the first rule of bug ownership? Watch your step!"
487,"Three drums and a cymbal rolled down a hill ba dum dum ching"
488,"What is invisible and smells like carrots? Bunny Farts."
489,"What did the number zero say to the number eight? Nice Belt"
490,"When I grow old, I am sure I will look back at my life and say ""aaaah! my neck hurts"""
491,"The pollen count  that's a difficult job! [Credit to Milton Jones]"
492,"Why did the cowgirl name her pony ink? Because it kept running out of the pen!! My favorite joke when young :)."
493,"Did you know yesterday was National Middle Child Day? Don't worry, no one else remembered either."
494,"Have you heard about the 2 Spanish firemen? Jose and hose B"
495,"There are two types of people in this world 1. Those who can extrapolate from incomplete data"
496,"What did the flat iron say to the follicle? Now let me get this straight . . ."
497,"6:30 is the best time on a clock... ...hands down."
498,"I love graphs! I used to be obsessed with them... I've calmed down now though, you've gotta draw the line somewhere"
499,"What kind of car did the German cowboy purchase? Audi *tips hat*"
500,"Garbage men have Hefty contracts."
501,"Dolphins don't do anything by accident.. Always on porpoise."
502,"What do you call a fish with no eyes? A fsh"
503,"What goes oh oh oh? Santa walking backwards."
504,"Why does a milking stool have only three legs? Because the cow has the udder!"
505,"A skeleton walks into a bar orders a beer and a mop."
506,"First original joke! Why did the rapper visit the urologist? Because his flows were so sick."
507,"What's gray and all around? Everything. I'm a dog."
508,"~tips fedora at mosquito~ Mlaria"
509,"Need help While scratching my ear with key few hours ago, audio on my brand new TV went off. Does anyone know good TV Service. Sh... I think my Laptop sound died too."
510,"Who's the world's greatest underwater spy? Pond. James Pond."
511,"Why was the belt locked up? Because it held a pair of pants."
512,"How many apples grow on a tree? All of them."
513,"Alrighty Kids always remember: you are what you eat So eat loads of sweets and pass on those vegetables"
514,"How did the desk lamp store manager feel when thieves stole all his lightbulbs? He was delighted."
515,"Did you hear about Scrooge's drinking problem? He had a dickens of a time with spirits."
516,"Cogito Ergo Spud. I think, therefore I yam."
517,"What's the best part about twenty two year old wheels of cheese? There are twenty of them."
518,"My brother said he's incontinent. Yeah, he said he's wet his pants in nearly every nation in the world."
519,"What do you call an elephant with a poor memory? A bold and innovative departure from the hackneyed stereotypes that all too often dominate the joke-telling industry."
520,"What do you call a nose without a body? Nobody knows..."
521,"How do you know ancient Egyptians loved books so much? Because they built their stuff with reads!"
522,"Old game show bloopers...I miss this kind of humor today Found this video randomly http://www.youtube.com/watch?v=xv3gK2bmkAk&amp;feature=related"
523,"Where do weirdos ride their bicycles? Psycho-paths. (as told by one of my coworkers)"
524,"Why do sailors give their wives a bouqet of ropes instead of flowers?? It's a bouqet of forget-me-knots."
525,"What's the difference between a hippo and a zippo? One is really heavy, and the other is a little lighter."
526,"Where did the cat go when it lost it's tail? To the retail store!"
527,"What do you call an Italian romance novel model who's let himself go? Flabio"
528,"What do you call a lion in the circus. A Carny-vore"
529,"Actually, there are but two types of people Those who can extrapolate from limited data ..."
530,"Why'd the chicken cross the Mobius strip? To get to the same side."
531,"X-post from r/jokes: ""Hey! The dog you sold me yesterday just fell over and died today!"" ""Huh, strange. He's never done that before."""
532,"What is the longest word in the English language? SMILES because there is a mile between the first and last letters!"
533,"I had a joke about time travel but you guys didn't like it."
534,"How does the farmer count up his cows? ...with a cowculator."
535,"I would make a sparrow joke... But they don't fly very well."
536,"Why did the golfer need to buy a new pair of socks? Because he got a hole in one!"
537,"Why don't you want to hang out with a dude from Chicago? Because 'Illinois you!"
538,"What did the fish say when it hit the wall? Dam"
539,"What does Colonel Mustard's Mexican maid call him? *(Phonetically-ish)* Mis'ser Dijon."
540,"Did you hear about the man who was accidentally buried alive? It was a grave mistake. Woohoo! I'm making these up!!"
541,"What do you call a happy penguin? A pengrin!"
542,"What did the green grape say to the purple grape? ""Breathe you idiot! Breathe!"""
543,"Did you hear about the two monocles at the party? They made spectacles out of themselves."
544,"What do you get when you drop a piano in a coal mine? A flat minor. Night... Don't forget to tip your waitress"
545,"Wanna hear a dirty joke? A white horse fell in the mud."
546,"A skeleton walks into a bar The bartender says, what will you have? Skeleton says, a beer... and a mop"
547,"My daughter hit me with this one while preparing for dinner Why did the table love playing volleyball? Because it was always getting set! I think she gets it from her mother."
548,"How did the aquarium win the battle? Giant Fish Tanks."
549,"What do you call an alligator in a vest? An investigator"
550,"What does a duck call a tractor? A quacktor"
551,"What did daddy fish do when mommy fish got herself lost? ...He flounder"
552,"There are three types of people in this world. Those who can count and those who can't."
553,"Why did the chicken kill itself? To get to the other side."
554,"Why can't you hear a pterodactyl use the restroom? Because the *p* is silent"
555,"I thought about starting a business selling halos... ...but the cost of overheads was too high."
556,"Where did the team get there uniforms? New Jersey"
557,"Programmers tend to byte their food"
558,"What do you call a group of security guards in front of a Samsung store? Guardians of the Galaxy."
559,"I heard the best time travel joke tomorrow."
560,"What do you call a woman on a cruise ship in Mexico using the diving board at the pool? A broad abroad on a board aboard."
561,"What did the topic sentence say to the evidence? Why aren't you supporting me?"
562,"What do you get when you mix Michael Jordan with Donald Trump? A Dunkin' Donut."
563,"Two horses are standing in a field. ""I'm so hungry I could eat a horse"" Says the first. ""Moo!"" says the second"
564,"What do you call a pile of kittens? A meowtin"
565,"What happens to a frog's car when it breaks down? It gets toad away."
566,"Two peanuts were walking down the street.... And one of them was assaulted"
567,"If you walk into the bathroom an American and walk out an American, what are you in the bathroom? European."
568,"An ion walked up to Lost and Found and reported that he had lost an electron. The clerk asked:are you sure? The ion replied :Yes, I am positive.VCN"
569,"What do you say to your sister when she's crying? Are you having a crisis?"
570,"What do you call a cross between a gorilla and a monkey? A cross."
571,"What do you call it when Google Glass connects to the internet? Eye-fi."
572,"Why did the Kurd bury his music collection? His tribesman said ""ISIL is approaching, and they're coming for Yazidis."""
573,"This mallard waddled into a bar... Should've ducked."
574,"We now have TWO Wawa's by the interstate. The one on the east side of I4 is not so bad. But the other one, whoa. It's the Wawa West over there."
575,"What' the difference between roast beef and pea soup? Anyone can roast beef, but not everyone can pea soup. (As told by my 8yo, who made me laugh with a joke for the first time. Proud dad moment.)"
576,"the only one of its kind on this sub Want to hear a dirty joke? horse fell in the mud!"
577,"What do you call it when Batman skips church? Christian Bale."
578,"What do you call a social media platform designed for religious people who also have speech impediments? Faithbook"
579,"I'm so sad because my friend is moving to Shanghai. More like Shang-bye."
580,"What do you call a alligator in a vest? Investigator."
581,"How to create a clean joke Step 1. Find a dirty joke Step 2. Clean it"
582,"A skelleton goes to the bar and says ""Can I have a pint and a mop..."""
583,"Did you hear about the fortune teller that... Had bad breath, calluses all over his body and couldn't win a fight? He was a Super Callused Fragile Mystic Hexed with halitosis."
584,"Why was the scarecrow promoted? Because he was outstanding in his field!"
585,"My friend gave me a balloon and told me not to pop it.. but I blew it!"
586,"My old roommate's bathroom was so dirty- -I had to clean the soap before using it. (Seriously.)"
587,"Why did the paper follow the pencil? Because it LED THE WAY! I'm on a roll here! this is fun! ~Skip"
588,"Why does a chicken coupe only have two doors? If it had four it'd be a chicken sedan!"
589,"What do you call a cow with only two legs? Lean Beef!"
590,"Why was the school grey? Because it was a Greyed School. I woke up with this joke in my head this morning. I think my brain is trying to kill me with horrible puns."
591,"Want to hear a clean Joke? Johnny took a bath with bubbles. Want to hear a dirty one? Bubbles is a man"
592,"Why do sharks swim in salt water? Because pepper would make them sneeze!"
593,"A Siri joke!: Two iPhones walk into a bar... ...Carrying a set of iPod shuffles. The bartender says: &gt; Let those iPods sing, man! He was an iSurfer on iPad mini."
