"ID","Joke"
1189,"Why did the dinosaur cross the road? Because the chicken didn't exist."
1190,"Why does a rapper need an umbrella? Fo' drizzle."
1191,"What did Tennessee? What Arkansas."
1192,"My son decided to help me clean the car today. After ten minutes of watching him, I told him to use some elbow grease. Two hours later, the idiot came back and told me that he couldn't find it."
1193,"What do you call a group of Combi's? A Combi nation!"
1194,"How do you get down from an elephant? You don't, you get down from a duck"
1195,"You can pick your friends, and you can pick your nose... But you can't pick your friend's nose"
1196,"Which whiskey should you buy if you want to dance all night? Wild Twerky!"
1197,"Why couldn't the hunter cook breakfast? The game warden found out he poached his eggs!"
1198,"I went to an ATM... I was at an ATM this morning and this older lady asked me to help check her balance, so I pushed her over."
1199,"How much does a truck full of bones weigh? A skeleTon"
1200,"Why don't cats play poker in the jungle? Too many cheetahs!"
1201,"A skeleton walks into a bar... Asks for a beer and a mop."
1202,"What do you call an atheist bone? A blasfemur."
1203,"How do you catch a one-of-a-kind rabbit? Unique up on it. How do you catch a very calm rabbit? The tame way."
1204,"Will Smith's website isn't responding. What do you do? Refresh Prince of Bel Air."
1205,"What the the electrician say to his buddy? Watts up?!"
1206,"How many South Americans does it take to change a lightbulb? A Brazilian.... I'll get my coat..."
1207,"How do you catch a bra? You set a booby trap."
1208,"April showers bring May flowers, but what do May flowers bring? Pilgrims."
1209,"Which cheese is the loneliest? Prov-alone!"
1210,"Did you hear the joke about the fast car? I would tell you but I think you're too slow to get it."
1211,"Why did the twinkie go to the dentist? He lost his filling!"
1212,"How does a fish always know how much they weigh? Because they have their own scales!"
1213,"What does music have to do with safety? If you don't C sharp, you'll B flat."
1214,"Why is there very little honey in Belgium? Because there is only one B in Belgium"
1215,"How many goals did Germany score? gerMANY"
1216,"Why did the elephant turn around in the airport and go home? He forgot to pack his trunk."
1217,"Two fish are in a tank... Two fish are in a tank... First one says: I'll drive! Second one says: ""I'll man the guns!"""
1218,"How many hipsters does it take to change a light bulb? it's a pretty obscure number.... i'm sure you haven't heard of it."
1219,"What celebrity never payed with a cheque or credit? Johnny Cash."
1220,"What is a pair of sheep's favorite instrument? Two-Baaas."
1221,"You know why ancient Greek children were always getting lost from their parents? 'Cause they kept Roman around!"
1222,"Have you heard about that hot Thai lounge singer? Yeah. They call him *Frank Sriracha.*"
1223,"...walks into a bar... A golfer, a priest and a lawyer walk into a bar. The bartender looks up and asks, ""What is this? Some kind of joke?"""
1224,"Other uses for chloroform 1) A great conversational piece when talking to the cops about using it 2) Make the day go by faster 3) And finally, as a reagent."
1225,"Cars Why do lazy people only drive automatics? Because they're shiftless."
1226,"Why is Yoda afraid of seven? Because six seven eight."
1227,"Why couldn't the pirate learn the alphabet? Because he was always lost at C."
1228,"College My son took Rock Climbing in college but he had to drop the class. He couldn't find any ""Cliff Notes."""
1229,"What is the cheapest part of a boat? The part with the sail in it."
1230,"Why was the egg kicked out of the comedy club? Because he was telling bad yolks!"
1231,"You know what's the problem with Mexican and black jokes? If you've heard Juan, you've heard Jamaal."
1232,"The signature dish of a restaurant called the Twisted Rooster: Mobius Chicken Strips."
1233,"What did one math book say to the other? Don't bother me; I've got my own *problems!*"
1234,"Why are giraffes slow to apologize? It takes them a long time to swallow their pride"
1235,"Velcro What a rip off. Joke by Tim Vine."
1236,"Why don't melons ever run away and get married? Because they cantaloupe!"
1237,"Like most people my age... I'm 27."
1238,"Two fish in a tank Fish 1:Uh, Greg? Fish 2:What Fish 1:How do we drive this thing"
1239,"Did you hear about the Italian chef that died? He pasta way."
1240,"Why did the bacteria cross the microscope? To get to the other slide"
1241,"I read a story about a kid that ate 4 cans of alphabet soup in one sitting... It said that he later had a massive vowel movement. Maybe a dirty joke."
1242,"Tasted the best Borscht ever! It'll be hard to beet."
1243,"The Fine Bros. 'React' announcement was like a television with no antenna. Poor reception."
1244,"What do call a horse that lives near you? A naybor"
1245,"What kind of bees make milk? Boobies."
1246,"What does Mario use to get his hot dogs off the grill? He uses his Donkey Tongs."
1247,"""We don't serve time travelers here"" A time traveler walks into a bar."
1248,"How do you kill bread? Bake it for a little while, and it will be toast."
1249,"What do you call an imaginary color? A pigment of your imagination."
1250,"Did you hear about the mathematician who hated negative numbers? He'll stop at nothing to avoid them!"
1251,"What do you call security guards working outside Samsung shops? Guardians of the Galaxy"
1252,"What do you call cheese that is by itself? Provolone"
1253,"I just got a job helping a one arm typist do capital letters... Its shift work."
1254,"Why does a Bicycle have a kickstand? Because it's two tired."
1255,"Which side of a horse has the most hair? The OUTSIDE! oh-my-goodness, that's hilarious! ~Skip"
1256,"I went in to a pet shop and said, Can I buy a goldfish? The guy said, Do you want an aquarium? I said, I dont care what star sign it is."
1257,"Noah wasn't much for civilized society . . . You could say he was an-arc-ist."
1258,"Two silk worms had a race. They ended up in a tie."
1259,"What do you call a sheep covered in chocolate? A candy baa"
1260,"What do you do if you see a spaceman? You park in it, man."
1261,"Why did Trump insist on Hillary Clinton as Secretary of state? He doesn't believe women should get above secretary"
1262,"I was wondering why the frisbee was getting bigger. And then it hit me."
1263,"What did the Buffalo say when his child left for college? Bison"
1264,"How do you keep an idiot in suspense? I'll tell you later."
1265,"Batman doesn't have nightmares Nightmares have batman"
1266,"Charles Dickens walks into a bar... and orders a martini. The bartender asks ""olive 'er twist?"""
1267,"Nickelback walks into a bar.... So Nickelback walks into a bar, and there is no punchline, because ruining music isn't funny."
1268,"So a polar bear walks into a bar... and says, ""I'll have a gin.....and tonic"" The bartender says, ""What's with the big pause?"" And the polar bear says, ""Oh, I've always had them."""
1269,"Mom asked if I wanted to race toy cars with my neighbor Chucky. I responded, ""Nah, that's child's play."""
1270,"What do you find in a cloud's shorts? Thunderpants!"
1271,"Why did the SSD burn a flag? Because it was a Patriot Blaze"
1272,"Difference between a dead squirrel and a dead drummer in the road? http://imgur.com/PKibj The squirrel might have been on his way to a gig."
1273,"By shear coincidence... ...all these sheep look the same..."
1274,"Finally decided on my thesis paper. It's a LOTR themed essay in defense of Sauron Titled ""Getting away with Mordor"""
1275,"What do you call a bee from the wrong side of town? A bumblegee"
1276,"Why did Mrs. Grape leave Mr. Grape? She was tired of raisin kids."
1277,"What does batman take in his whiskey? Just ice."
1278,"What do you call a boomerang that doesn't come back? A Stick"
1279,"A guy walks into a bar Ouch"
1280,"Why did the scale decide that the scam artists were heavier than the novels? Because the cons outweighed the prose."
1281,"Im trying to get into classical music... ...but I cant find any original recordings. All the music is performed by cover bands."
1282,"What did aged mother cheddar say to her son the day of school photos? Looking sharp."
1283,"Why does a chicken coop have two doors? Because if it had four it would be a chicken sedan!"
1284,"Note for Santa Dear Santa, Please give me a big fat bank account and a slim body. Please don't mix those two up like you did last year. Thanks."
1285,"Why was Pavlov's hair so soft? He conditioned it."
1286,"What's an atheist's favorite Christmas movie? Coincidence on 34th Street"
1287,"What do you call someone who makes a lot of money through deforestation of the Amazon? A Brazillionaire!"
1288,"Whats Marios favorite type of jeans? denim denim denim!"
1289,"What did the 0 say to the 8? Let's make a snowman!"
1290,"Have a very Joseph Christmas! We shouldn't discriminate by sex, you know."
1291,"Never try to kill a termite with a napkin. It'll only get bigger."
1292,"What did one nose say when the other nose said ""I love you""? ""Back achoo!"""
1293,"Hope you guys like clean humor videos https://www.youtube.com/watch?v=kNt-aTq0hxM"
1294,"Why don't blind people like to skydive? Because it scares the dog."
1295,"Two guys walk into a bar... the third one ducks."
1296,"What did the french butter say when it got stocked in the cooler? Beurre... I came up with this today while grocery shopping. I'm ridiculously pleased with myself."
1297,"Why did the dog sleep on the chandelier? Because he was a light sleeper."
1298,"What happens when a spoon and fork get into a fight? civilwar"
1299,"My grandma refused to be an organ donor. She was buried with all of her musical instruments."
1300,"How do you count cows? With a cowculator."
1301,"I dig, she dig, we dig, he dig, they dig, you dig ... Maybe not a funny joke but at least it is deep."
1302,"What do you call a burial chamber full of Moose? Moosoleum."
1303,"Mints I was eating mint chocolates and I felt sick after eight."
1304,"A Polar Bear walks into a cafe He says, ""I'll have a burger and.... a coke."" The waitress says, ""Okay. But, why the long pause?"" The bear says, ""I don't know. I was born with them."""
1305,"What did the hot dogs name their child? Frank"
1306,"I may be middle-class, but I'm hard. *Al dente*, you might say. **Jimmy Carr**"
1307,"What do you say when you see three whales? Whale whale whale, what do we have here?"
1308,"What did Cinderella say while waiting for her photos? Someday my prints will come"
1309,"What did the fish say when it hit the concrete wall? Dam"
1310,"My Bucket List * ~~Five gallon bucket~~ * ~~Mop bucket~~ * Bucket hat"
1311,"What do you call an old soldier who has been sprinkled in salt and pepper? A seasoned veteran."
1312,"The fast food restaurant for babies. ""Welcome to Gerber King, may I take your order?"""
1313,"What did one frog say to the other? Time's fun when you're having flies."
1314,"What do you get when you cross the Atlantic with the Titanic? Halfway."
1315,"Want to hear a dirty joke? This boy trips and falls into some mud."
1316,"No matter how much you push the envelope... ...it's still stationery."
1317,"My buddy went to a foreign country to get his sex change operation. Now he's a dude who's abroad."
1318,"A vampire stopped coming to my nightly poker games. All I said was that he made too many mistakes..."
1319,"What's the most beautiful thing in Advanced Physics? A passing grade. :)"
1320,"I bought a vacuum cleaner six months ago... ...and so far, all it's been doing is gathering dust."
1321,"Where do you drown a hipster? The Mainstream."
1322,"What did the mama cow say to the baby cow? (x-post from /r/3amjokes) [It's pasture bedtime!](http://www.reddit.com/r/3amjokes/comments/1y8d67/what_did_the_mama_cow_say_to_the_baby_cow/)"
1323,"Why did the man with one hand cross the road? To get to the second hand shop!"
1324,"An invisible man marries an invisible woman... The kids were nothing to look at either."
1325,"What did the creepy scientist say to his new creepy wife? Let's grow MOLD together!"
1326,"Never trust an atom They make up everything"
1327,"When you cook duck you should always add a little bit of goose It makes a game out of every bite."
1328,"A pair of mittens says to a hat, ""I'll stay here, you go on a head"""
1329,"What is black, bitter and dont work worth a damn? Decaf coffee"
1330,"Knock, Knock... Who's there? Peas. Peas who? *Peas pass the butter*"
1331,"My ""go to"" zoo joke I tell this to my wife and kids every time we go to a zoo... Q. What do you get when you cross an elephant with a rhino? A. Elephino"
1332,"Why did the chicken cross the road half-way? She wanted to lay it on the line."
1333,"I knew this guy who was so dumb... he saw a road sign that said, ""Disney Land Left"", so he turned around and went home."
1334,"I'm not really sure I'm understanding this financial crisis in Greece... It's all Greek to me."
1335,"What happened when porky pig fell asleep at his construction job? The foreman fired him, saying, 'We can't have bored boars boring boards.'"
1336,"Did you hear about that spicy knight? Sir Acha."
1337,"What did the Buddhist say to the hot dog vendor? Make me one with everything."
1338,"What do you call a cow with no legs? Ground beef."
1339,"There once was a girl from Nantucket... Who carried her ice in a bucket. She walked down a hill. She had a great spill. And when she got up, she said, ""I'm going to watch my step next time!"""
1340,"Why are bears so hairy ? They don't have salons in the jungle !"
1341,"How many tickles does it take to make an octopus laugh? ten-tickles"
1342,"Which is faster, hot or cold? Hot is faster. Anyone can catch a cold."
1343,"Do you think George Clooney has an iTunes playlist called Clooney Tunes?"
1344,"I was going to go to a clairvoyants meeting the other day but.... it was cancelled due to unforeseen events."
1345,"Joke request Tell me your best joke that includes ""July"" ""fourth"" and ""fire"" Let's see what you've got, Reddit!"
1346,"What is black, white, and red all over? A Communist Propaganda film from the 1930s."
1347,"[OC c/o my 9 y.o.] What holds up a bowl's pants? Suspoonders!"
1348,"I don't like going to funerals early in the day. I'm not much of a mourning person."
1349,"What happens when breed a shark and snowman? You get a frostbite!"
1350,"Which letter of the alphabet is the laziest? letter G (lethargy)"
1351,"whats brown and sticky? a stick!"
1352,"Which day do chickens fear most? Fryday."
1353,"What did the knob say to the door? I LOCK you a lot! yep, its corny, indeed, but... I'm tryin'! ~Skip"
1354,"Shout out to... ...baseball players who have three strikes."
1355,"why do they call them light bulbs? they don't weigh very much"
1356,"What's a reporter's favorite food? Ice cream because they always want a scoop!"
1357,"Why did the scarecrow win the Nobel prize? He was outstanding in his field."
1358,"Is your refrigerator running? Well, you better get glasses, and stop doing drugs"
1359,"A stamp collector walks into a bar... He walks up to the hostess and says, ""You're more beautiful than any stamp in my collection"" She replied, ""Philately will get you nowhere."""
1360,"I personally don't believe in bros before hoes or hoes before hoes.. There needs to be a balance. A homie-hoe-stasis"
1361,"How do you fix a broken pumpkin? With a pumpkin patch!"
1362,"My dad's not an alcoholic... ...He just collects empty bottles, sounds so much better, doesn't it? ~ Stewart Francis"
1363,"I believe a lot of conflict in the Wild West could have been avoided completely... ...if cowboy architects had just made their towns big enough for everyone."
1364,"Q) What do you call a group of 8 rabbits? A) Rabbyte!"
1365,"What is a bacteria's OTHER favorite dish? The PETRI dish!"
1366,"What do you call a productive Asian? China get something done."
1367,"Why do ghosts carry tissues? Because they have BOOOOgers."
1368,"Two pretzels.. Two pretzels went walking down the street, one was ""assaulted"""
1369,"What is the Sun's favorite candy? Starburst! Another one from my 9 year old. I don't know where he gets it."
1370,"I just met someone who was a steam-roller operator. He was such a flatterer."
1371,"Why did the chicken cross the road? To get away from Gordon ramsey"
1372,"What did the turkey say to the turkey hunter? ""Quack, quack, quack."""
1373,"What is the difference between a man and a cat? One eats a lot, is lazy and doesnt care who brings the food. The other is a pet."
1374,"How do you confuse a fish? You put it in a bowl and tell it go to a corner!"
1375,"Have you guys ever heard of the crazy Mexican Train Killer? He had...... Loco Motives"
1376,"Do you know why there's no casinos in Africa? Because there's too many CHEETAHS!"
1377,"what did the zero say to the eight? nice belt"
1378,"They laughed when I said I wanted to be a comedian. Well, no ones laughing now."
1379,"I just heard because of the government shutdown government archeologists are working with a skeleton crew."
1380,"Why do abcdefghijklmopqrstuvwxy &amp; z hate hanging out with the letter n? Because n always has to be the center of attention."
1381,"Why couldn't Bach pay for his dinner? Because he was Baroque."
1382,"What is the difference... What is the difference between unlawful and illegal? One is against the law and the other is a sick bird."
1383,"What did one ocean say to the other? Nothing, they just waved."
1384,"What's made of brass and sounds like Tom Jones? Trombones!"
1385,"Why did the Wise Man get 25 to life? Myrrhder"
1386,"What do you call a dinosaur FBI agent? A pteredacted."
1387,"What did the fish say when it ran into the wall? Dam"
1388,"16 sodium atoms walk into a bar followed by Batman."
1389,"What's the difference between a poorly dressed man on a tricycle and a well dessed man on a bicycle? Attire...!!"
1390,"What did the pilot say when his plane wasn't flying? ""Aw man, that's a drag."""
1391,"I asked my soap who it voted for, it said... I'd lather not say! note: This one came to me in the shower just now, gotta go back in now. Oh, the irony! I think. ~Skip"
1392,"Why did the coffee file a police report? Because it was mugged."
1393,"How does the man in the moon cut his hair? Eclipse it."
1394,"How did the burglar get into the house? Intruder window"
1395,"Two chimps are in the bath One says ""ooh oooh eek eek"" The other one says ""well put some cold water in then!"""
1396,"What do ducks do at Christmas time? They duckerate cookies."
1397,"What do you call a dead fly? a flew"
1398,"Knock knock. Who's there? Interrupting cow. Interrup........ MOOOOOOOOOOOOOOOO!!!! [Works best IRL](/spoiler)"
1399,"What di you call a snowman in may? A puddle!"
1400,"What do you call a white supremacist who doesn't eat meat? A vegitaryan"
1401,"How is a rabbit similar to a plum? they are both purple, except for the rabbit."
1402,"Why are there no midget accountants? They always come up short."
1403,"What do you call a noisy Chinese dog? How-Ling (my dad wanted me to post this)"
1404,"Why can't you hear a pterodactyl in the bathroom ... because the ""p"" is silent"
1405,"How did the Pillsbury Dough Boy Die? A Yeast Infection"
1406,"What do you call a native american cook a sioux chef"
1407,"I said bring your coffee maker whenever you want Them: great headphones on planes is heavier than flying over TEAs"
1408,"A poem for Valentine's day Roses are red Poppies are red The grass is red Oh no my yard is on fire"
1409,"What did the dad buffalo say when his offspring left for college? Bison"
1410,"How do you get Pikachu on the bus? Poke 'em on!"
1411,"Whats brown and sticky? a stick"
1412,"What do you call a fish that operates on brains? A brain sturgeon."
1413,"The reason angels can fly... ...is that they take themselves lightly. **G. K. Chesterton**"
1414,"I'm in the terminator musical. I'll be Bach."
1415,"I try not to spend too much time online... ...but Wi-Fight it?"
1416,"What does December have that other months dont have? The letter D."
1417,"What's the best way to capitalize on an opportunity? ON AN OPPORTUNITY"
1418,"What's green, fuzzy, and if it falls out of a tree it'll kill you? A pool table."
1419,"A termite walks into a bar... And asks the nearest person ""Hey, is the bar tender here?"""
1420,"I tired playing soccer But I couldn't get a kick out of it."
1421,"What did the priest say when watering his garden? Let us spray."
1422,"How did the musician catch his fish? He castanet"
1423,"What do you call a plastic sheep? Lambinated!"
1424,"I need this plant to grow. Well, water you waiting for?"
1425,"Book, you look so much thinner! I know! I had my appendix removed!"
1426,"Have you been injured in a car accident? call 555-bottom-feeders. We will do anything for money."
1427,"Did you hear about the stallion and the mare? They had a stable relationship."
1428,"What are two doctors with colds An ironic Paradox."
1429,"What do you get when you cross Kansas with a vulture? Carrion my wayward son"
1430,"How do you know it's time to go to bed? Hitler is raping you!"
1431,"What do you call a Romanian grocery clerk? Scanthesku"
1432,"What do you call a fear of horned bovines? Aurochnophobia."
1433,"What haircut did the Texan barber recommend when asked? He couldn't think of anything, and said ""I'll mullet over"""
1434,"[OC] How does Gandhi measure passive resistance? In oooooohms."
1435,"Why is Kim Jong Un like todays music? They both ain't got the same Seoul."
1436,"I knew this guy who would ask men at church, ""is your tie made out of bird cloth?"" &lt;blank stare&gt; ""It's cheep, cheep, cheep."""
1437,"What happened when the carrot died? There was a huge turnip at the funeral."
1438,"Why can't you hear a pterodactyl go to the bathroom? Because the P is silent"
1439,"Why do librarians like the wind? It says, ""Shhh!"" all day!"
1440,"One potato asks another: -""Are you sure we are related?"" -""Yes I yam!"""
1441,"I like my slaves like I like my coffee Free."
1442,"Who is the only superhuman Frozone can't deal with? Thor."
1443,"Why don't bears wear boots? Cos they like to walk around in their bear feet."
1444,"There's 10 kind of people in the world. Those who know binary and those who don't."
1445,"What do you call the object Attila the Hun uses to brush his leg hair? A Hun knee comb."
1446,"Words can't possibly describe how beautiful you are... But numbers can 4/10"
1447,"What are twins favorite fruits? Pears"
1448,"Did you hear about the guy who fell into an upholstery machine? Now he's fully recovered."
1449,"Why did the chicken cross the road? To get to the moron's house. *knock knock* ^^Whose ^^there? *the chicken...*"
1450,"Why did the wave fail the driving test? It kept crashing on the beach."
1451,"What did one earthquake say to the other? Hey, it's not my fault."
1452,"I bought some shoes from a drug dealer, I don't know what he laced them with but I have been tripping all day. --My amazing girlfriend told me this one"
1453,"Request: Jokes for the sick? I have a good friend who was just hospitalized, hopefully nothing too serious. I'd love to send him a few short, clean jokes to cheer him up. Thanks!"
1454,"Why would no one listen to the percussion section? Because they couldn't drum up enough support."
1455,"What kind of bee can never be understood? A mumble-bee."
1456,"What's the difference between Botox and Borax? Two letters."
1457,"A broom only likes one brand of comedy. Dustpan."
1458,"If you bury someone in the wrong place then you have made a grave mistake."
1459,"A man walks into a fancy dress party carrying a woman on his back... The host asks the man why this is so. ""Oh, I'm a tortoise and this is Michelle"" says the man."
1460,"There's only one problem with reading articles about space based technology It all goes waaaay over my head."
1461,"Pac-Man What should you do before you criticize Pac-Man? WAKA WAKA WAKA mile in his shoes."
1462,"What does a bag of rice and an onion do when they get into a fast car? They pilaf. I'll show my way out"
1463,"Want to hear a joke about pizza? Never mind it is too cheesy."
1464,"What did the Triangle say to the Circle? ""Your life is pointless."""
1465,"HELP! We need your best joke you have! We will choose the best joke and make a video of it, just for you!"
1466,"I heard a great joke about a boomerang earlier. I'm sure it will come back to me eventually."
1467,"What did the pony say when he had a sore throat? Pardon me, I'm just a little hoarse."
1468,"I'm good friends with 25 letters of the alphabet... I don't know why."
1469,"What's pink and fluffy? Pink fluff. Whats blue and fluffy? Pink fluff holding its breath"
1470,"What's Sam Smith's favorite type of nut?  [It's an alllllllllmond](https://www.youtube.com/watch?v=fB63ztKnGvo&amp;feature=youtu.be&amp;t=37s)"
1471,"What did the koala bear say to the barber? You ca-lip this?"
1472,"What city loves to eat sandwiches? Koldcutta"
1473,"Why aren't sumos chummy with racecar drivers? They move in different circles."
1474,"What do you call shaving a crazy sheep? Shear madness."
1475,"Why don't tennis players get married? Because to them love means nothing."
1476,"What do you call a fake noodle? An Impasta"
1477,"I thought I had a brain tumor but then I realized it was all in my head."
1478,"Did you know that 1 in every doll, in every doll, in every doll, in every doll are Russian?"
1479,"Today's my cake day! And I'm going to eat it too!"
1480,"How do you kill a vampire from the South? With a chicken fried stake"
1481,"You can pick your friends, and you can pick your nose... But you can't pick your friend's nose"
